{
  "version": 1,
  "id": "tiny_standing",
  "createdUtc": "2026-10-01T00:00:00Z",
  "anchor": {"id": "", "position": [0.0, 0.0, 0.0], "yaw": 0.0},
  "outline": [[-1.0, -1.0], [1.0, -1.0], [1.0, 1.0], [-1.0, 1.0]],
  "sdf": {"cell": 0.05, "width": 50, "height": 50, "originX": -1.25, "originZ": -1.25, "data": "e/6d/rr+0v7j/uz+7f7t/u3+7f7t/u3+7f7t/u3+7f7t/u3+7f7t/u3+7f7t/u3+7f7t/u3+7f7t/u3+7f7t/u3+7f7t/u3+7f7t/u3+7f7t/u3+7f7t/uz+4/7S/rr+nf57/p3+wv7j/v/+E/8e/x//H/8f/x//H/8f/x//H/8f/x//H/8f/x//H/8f/x//H/8f/x//H/8f/x//H/8f/x//H/8f/x//H/8f/x//H/8f/x//H/8f/x//H/8e/xP///7j/sL+nf66/uP+Cf8p/0L/T/9R/1H/Uf9R/1H/Uf9R/1H/Uf9R/1H/Uf9R/1H/Uf9R/1H/Uf9R/1H/Uf9R/1H/Uf9R/1H/Uf9R/1H/Uf9R/1H/Uf9R/1H/Uf9R/1H/T/9C/yn/Cf/j/rr+0v7//in/T/9u/4H/g/+D/4P/g/+D/4P/g/+D/4P/g/+D/4P/g/+D/4P/g/+D/4P/g/+D/4P/g/+D/4P/g/+D/4P/g/+D/4P/g/+D/4P/g/+D/4P/g/+D/4H/bv9P/yn///7S/uP+E/9C/27/lv+x/7X/tf+1/7X/tf+1/7X/tf+1/7X/tf+1/7X/tf+1/7X/tf+1/7X/tf+1/7X/tf+1/7X/tf+1/7X/tf+1/7X/tf+1/7X/tf+1/7X/tf+x/5b/bv9C/xP/4/7s/h7/T/+B/7H/3f/n/+f/5//n/+f/5//n/+f/5//n/+f/5//n/+f/5//n/+f/5//n/+f/5//n/+f/5//n/+f/5//n/+f/5//n/+f/5//n/+f/5//n/+f/3f+x/4H/T/8e/+z+7f4f/1H/g/+1/+f/GQAZABkAGQAZABkAGQAZABkAGQAZABkAGQAZABkAGQAZABkAGQAZABkAGQAZABkAGQAZABkAGQAZABkAGQAZABkAGQAZABkAGQAZAOf/tf+D/1H/H//t/u3+H/9R/4P/tf/n/xkASwBLAEsASwBLAEsASwBLAEsASwBLAEsASwBLAEsASwBLAEsASwBLAEsASwBLAEsASwBLAEsASwBLAEsASwBLAEsASwBLAEsAGQDn/7X/g/9R/x//7f7t/h//Uf+D/7X/5/8ZAEsAfQB9AH0AfQB9AH0AfQB9AH0AfQB9AH0AfQB9AH0AfQB9AH0AfQB9AH0AfQB9AH0AfQB9AH0AfQB9AH0AfQB9AH0AfQBLABkA5/+1/4P/Uf8f/+3+7f4f/1H/g/+1/+f/GQBLAH0ArwCvAK8ArwCvAK8ArwCvAK8ArwCvAK8ArwCvAK8ArwCvAK8ArwCvAK8ArwCvAK8ArwCvAK8ArwCvAK8ArwCvAH0ASwAZAOf/tf+D/1H/H//t/u3+H/9R/4P/tf/n/xkASwB9AK8A4QDhAOEA4QDhAOEA4QDhAOEA4QDhAOEA4QDhAOEA4QDhAOEA4QDhAOEA4QDhAOEA4QDhAOEA4QDhAOEArwB9AEsAGQDn/7X/g/9R/x//7f7t/h//Uf+D/7X/5/8ZAEsAfQCvAOEAEwETARMBEwETARMBEwETARMBEwETARMBEwETARMBEwETARMBEwETARMBEwETARMBEwETARMBEwHhAK8AfQBLABkA5/+1/4P/Uf8f/+3+7f4f/1H/g/+1/+f/GQBLAH0ArwDhABMBRQFFAUUBRQFFAUUBRQFFAUUBRQFFAUUBRQFFAUUBRQFFAUUBRQFFAUUBRQFFAUUBRQFFARMB4QCvAH0ASwAZAOf/tf+D/1H/H//t/u3+H/9R/4P/tf/n/xkASwB9AK8A4QATAUUBdwF3AXcBdwF3AXcBdwF3AXcBdwF3AXcBdwF3AXcBdwF3AXcBdwF3AXcBdwF3AXcBRQETAeEArwB9AEsAGQDn/7X/g/9R/x//7f7t/h//Uf+D/7X/5/8ZAEsAfQCvAOEAEwFFAXcBqQGpAakBqQGpAakBqQGpAakBqQGpAakBqQGpAakBqQGpAakBqQGpAakBqQF3AUUBEwHhAK8AfQBLABkA5/+1/4P/Uf8f/+3+7f4f/1H/g/+1/+f/GQBLAH0ArwDhABMBRQF3AakB2wHbAdsB2wHbAdsB2wHbAdsB2wHbAdsB2wHbAdsB2wHbAdsB2wHbAakBdwFFARMB4QCvAH0ASwAZAOf/tf+D/1H/H//t/u3+H/9R/4P/tf/n/xkASwB9AK8A4QATAUUBdwGpAdsBDQINAg0CDQINAg0CDQINAg0CDQINAg0CDQINAg0CDQINAg0C2wGpAXcBRQETAeEArwB9AEsAGQDn/7X/g/9R/x//7f7t/h//Uf+D/7X/5/8ZAEsAfQCvAOEAEwFFAXcBqQHbAQ0CPwI/Aj8CPwI/Aj8CPwI/Aj8CPwI/Aj8CPwI/Aj8CPwINAtsBqQF3AUUBEwHhAK8AfQBLABkA5/+1/4P/Uf8f/+3+7f4f/1H/g/+1/+f/GQBLAH0ArwDhABMBRQF3AakB2wENAj8CcQJxAnECcQJxAnECcQJxAnECcQJxAnECcQJxAj8CDQLbAakBdwFFARMB4QCvAH0ASwAZAOf/tf+D/1H/H//t/u3+H/9R/4P/tf/n/xkASwB9AK8A4QATAUUBdwGpAdsBDQI/AnECowKjAqMCowKjAqMCowKjAqMCowKjAqMCcQI/Ag0C2wGpAXcBRQETAeEArwB9AEsAGQDn/7X/g/9R/x//7f7t/h//Uf+D/7X/5/8ZAEsAfQCvAOEAEwFFAXcBqQHbAQ0CPwJxAqMC1QLVAtUC1QLVAtUC1QLVAtUC1QKjAnECPwINAtsBqQF3AUUBEwHhAK8AfQBLABkA5/+1/4P/Uf8f/+3+7f4f/1H/g/+1/+f/GQBLAH0ArwDhABMBRQF3AakB2wENAj8CcQKjAtUCBwMHAwcDBwMHAwcDBwMHA9UCowJxAj8CDQLbAakBdwFFARMB4QCvAH0ASwAZAOf/tf+D/1H/H//t/u3+H/9R/4P/tf/n/xkASwB9AK8A4QATAUUBdwGpAdsBDQI/AnECowLVAgcDOQM5AzkDOQM5AzkDBwPVAqMCcQI/Ag0C2wGpAXcBRQETAeEArwB9AEsAGQDn/7X/g/9R/x//7f7t/h//Uf+D/7X/5/8ZAEsAfQCvAOEAEwFFAXcBqQHbAQ0CPwJxAqMC1QIHAzkDawNrA2sDawM5AwcD1QKjAnECPwINAtsBqQF3AUUBEwHhAK8AfQBLABkA5/+1/4P/Uf8f/+3+7f4f/1H/g/+1/+f/GQBLAH0ArwDhABMBRQF3AakB2wENAj8CcQKjAtUCBwM5A2sDnQOdA2sDOQMHA9UCowJxAj8CDQLbAakBdwFFARMB4QCvAH0ASwAZAOf/tf+D/1H/H//t/u3+H/9R/4P/tf/n/xkASwB9AK8A4QATAUUBdwGpAdsBDQI/AnECowLVAgcDOQNrA50DnQNrAzkDBwPVAqMCcQI/Ag0C2wGpAXcBRQETAeEArwB9AEsAGQDn/7X/g/9R/x//7f7t/h//Uf+D/7X/5/8ZAEsAfQCvAOEAEwFFAXcBqQHbAQ0CPwJxAqMC1QIHAzkDawNrA2sDawM5AwcD1QKjAnECPwINAtsBqQF3AUUBEwHhAK8AfQBLABkA5/+1/4P/Uf8f/+3+7f4f/1H/g/+1/+f/GQBLAH0ArwDhABMBRQF3AakB2wENAj8CcQKjAtUCBwM5AzkDOQM5AzkDOQMHA9UCowJxAj8CDQLbAakBdwFFARMB4QCvAH0ASwAZAOf/tf+D/1H/H//t/u3+H/9R/4P/tf/n/xkASwB9AK8A4QATAUUBdwGpAdsBDQI/AnECowLVAgcDBwMHAwcDBwMHAwcDBwPVAqMCcQI/Ag0C2wGpAXcBRQETAeEArwB9AEsAGQDn/7X/g/9R/x//7f7t/h//Uf+D/7X/5/8ZAEsAfQCvAOEAEwFFAXcBqQHbAQ0CPwJxAqMC1QLVAtUC1QLVAtUC1QLVAtUC1QKjAnECPwINAtsBqQF3AUUBEwHhAK8AfQBLABkA5/+1/4P/Uf8f/+3+7f4f/1H/g/+1/+f/GQBLAH0ArwDhABMBRQF3AakB2wENAj8CcQKjAqMCowKjAqMCowKjAqMCowKjAqMCowJxAj8CDQLbAakBdwFFARMB4QCvAH0ASwAZAOf/tf+D/1H/H//t/u3+H/9R/4P/tf/n/xkASwB9AK8A4QATAUUBdwGpAdsBDQI/AnECcQJxAnECcQJxAnECcQJxAnECcQJxAnECcQI/Ag0C2wGpAXcBRQETAeEArwB9AEsAGQDn/7X/g/9R/x//7f7t/h//Uf+D/7X/5/8ZAEsAfQCvAOEAEwFFAXcBqQHbAQ0CPwI/Aj8CPwI/Aj8CPwI/Aj8CPwI/Aj8CPwI/Aj8CPwINAtsBqQF3AUUBEwHhAK8AfQBLABkA5/+1/4P/Uf8f/+3+7f4f/1H/g/+1/+f/GQBLAH0ArwDhABMBRQF3AakB2wENAg0CDQINAg0CDQINAg0CDQINAg0CDQINAg0CDQINAg0CDQLbAakBdwFFARMB4QCvAH0ASwAZAOf/tf+D/1H/H//t/u3+H/9R/4P/tf/n/xkASwB9AK8A4QATAUUBdwGpAdsB2wHbAdsB2wHbAdsB2wHbAdsB2wHbAdsB2wHbAdsB2wHbAdsB2wGpAXcBRQETAeEArwB9AEsAGQDn/7X/g/9R/x//7f7t/h//Uf+D/7X/5/8ZAEsAfQCvAOEAEwFFAXcBqQGpAakBqQGpAakBqQGpAakBqQGpAakBqQGpAakBqQGpAakBqQGpAakBqQF3AUUBEwHhAK8AfQBLABkA5/+1/4P/Uf8f/+3+7f4f/1H/g/+1/+f/GQBLAH0ArwDhABMBRQF3AXcBdwF3AXcBdwF3AXcBdwF3AXcBdwF3AXcBdwF3AXcBdwF3AXcBdwF3AXcBdwFFARMB4QCvAH0ASwAZAOf/tf+D/1H/H//t/u3+H/9R/4P/tf/n/xkASwB9AK8A4QATAUUBRQFFAUUBRQFFAUUBRQFFAUUBRQFFAUUBRQFFAUUBRQFFAUUBRQFFAUUBRQFFAUUBRQETAeEArwB9AEsAGQDn/7X/g/9R/x//7f7t/h//Uf+D/7X/5/8ZAEsAfQCvAOEAEwETARMBEwETARMBEwETARMBEwETARMBEwETARMBEwETARMBEwETARMBEwETARMBEwETARMBEwHhAK8AfQBLABkA5/+1/4P/Uf8f/+3+7f4f/1H/g/+1/+f/GQBLAH0ArwDhAOEA4QDhAOEA4QDhAOEA4QDhAOEA4QDhAOEA4QDhAOEA4QDhAOEA4QDhAOEA4QDhAOEA4QDhAOEA4QCvAH0ASwAZAOf/tf+D/1H/H//t/u3+H/9R/4P/tf/n/xkASwB9AK8ArwCvAK8ArwCvAK8ArwCvAK8ArwCvAK8ArwCvAK8ArwCvAK8ArwCvAK8ArwCvAK8ArwCvAK8ArwCvAK8ArwB9AEsAGQDn/7X/g/9R/x//7f7t/h//Uf+D/7X/5/8ZAEsAfQB9AH0AfQB9AH0AfQB9AH0AfQB9AH0AfQB9AH0AfQB9AH0AfQB9AH0AfQB9AH0AfQB9AH0AfQB9AH0AfQB9AH0AfQBLABkA5/+1/4P/Uf8f/+3+7f4f/1H/g/+1/+f/GQBLAEsASwBLAEsASwBLAEsASwBLAEsASwBLAEsASwBLAEsASwBLAEsASwBLAEsASwBLAEsASwBLAEsASwBLAEsASwBLAEsASwAZAOf/tf+D/1H/H//t/u3+H/9R/4P/tf/n/xkAGQAZABkAGQAZABkAGQAZABkAGQAZABkAGQAZABkAGQAZABkAGQAZABkAGQAZABkAGQAZABkAGQAZABkAGQAZABkAGQAZABkAGQDn/7X/g/9R/x//7f7s/h7/T/+B/7H/3f/n/+f/5//n/+f/5//n/+f/5//n/+f/5//n/+f/5//n/+f/5//n/+f/5//n/+f/5//n/+f/5//n/+f/5//n/+f/5//n/+f/5//n/+f/3f+x/4H/T/8e/+z+4/4T/0L/bv+W/7H/tf+1/7X/tf+1/7X/tf+1/7X/tf+1/7X/tf+1/7X/tf+1/7X/tf+1/7X/tf+1/7X/tf+1/7X/tf+1/7X/tf+1/7X/tf+1/7X/tf+1/7H/lv9u/0L/E//j/tL+//4p/0//bv+B/4P/g/+D/4P/g/+D/4P/g/+D/4P/g/+D/4P/g/+D/4P/g/+D/4P/g/+D/4P/g/+D/4P/g/+D/4P/g/+D/4P/g/+D/4P/g/+D/4P/g/+B/27/T/8p///+0v66/uP+Cf8p/0L/T/9R/1H/Uf9R/1H/Uf9R/1H/Uf9R/1H/Uf9R/1H/Uf9R/1H/Uf9R/1H/Uf9R/1H/Uf9R/1H/Uf9R/1H/Uf9R/1H/Uf9R/1H/Uf9R/1H/T/9C/yn/Cf/j/rr+nf7C/uP+//4T/x7/H/8f/x//H/8f/x//H/8f/x//H/8f/x//H/8f/x//H/8f/x//H/8f/x//H/8f/x//H/8f/x//H/8f/x//H/8f/x//H/8f/x//H/8f/x7/E////uP+wv6d/nv+nf66/tL+4/7s/u3+7f7t/u3+7f7t/u3+7f7t/u3+7f7t/u3+7f7t/u3+7f7t/u3+7f7t/u3+7f7t/u3+7f7t/u3+7f7t/u3+7f7t/u3+7f7t/u3+7f7s/uP+0v66/p3+e/4="},
  "walkable": {"outer": [[-0.7, -0.7], [0.7, -0.7], [0.7, 0.7], [-0.7, 0.7]], "holes": []},
  "freeRect": {"wf": 1.4, "df": 1.4},
  "lapSquare": {"side": 1.0},
  "curvature": {"l5": 0.942263, "l6": 0.759326, "r3": 0.63662, "floorL": 1.4, "floorR": 1.2},
  "cells": {"glued": {"nx": 1, "nz": 1, "sizeX": 1.4, "sizeZ": 1.4}, "aligned": {"n": 2, "m": 2, "g": 0.7}},
  "standing": true,
  "walls": [
    {"a": [-1.0, -1.0], "b": [1.0, -1.0], "height": 2.4, "openings": []},
    {"a": [1.0, -1.0], "b": [1.0, 1.0], "height": 2.4, "openings": []},
    {"a": [1.0, 1.0], "b": [-1.0, 1.0], "height": 2.4, "openings": []},
    {"a": [-1.0, 1.0], "b": [-1.0, -1.0], "height": 2.4, "openings": []}
  ],
  "objects": [],
  "quality": {"unknownShare": 0.0, "route": 0}
}
